# name: test/sql/datadog.test
# description: test the datadog extension (offline: load, secret, registration, error paths)
# group: [sql]

# Before the extension is loaded the table function does not exist.
statement error
SELECT * FROM read_datadog_logs(query => '*', "from" => 'now-15m', "to" => 'now');
----
does not exist

require datadog

# The reader is registered.
query I
SELECT count(*) >= 1 FROM duckdb_functions() WHERE function_name = 'read_datadog_logs';
----
true

# The service-dependency reader is registered.
query I
SELECT count(*) >= 1 FROM duckdb_functions()
WHERE function_name = 'read_datadog_service_dependencies';
----
true

# The sender is registered.
query I
SELECT count(*) >= 1 FROM duckdb_functions() WHERE function_name = 'send_datadog_logs';
----
true

# The native Datadog live-ingest lifecycle functions are registered.
query II
SELECT count(*) FILTER (WHERE function_name = 'datadog_serve') >= 1,
       count(*) FILTER (WHERE function_name = 'datadog_stop') >= 1
FROM duckdb_functions();
----
true	true

# Server arguments are validated before a socket is opened.
statement error
SELECT datadog_serve('http://127.0.0.1:10518');
----
expected 'datadog:host[:port]'

statement error
SELECT datadog_serve('datadog:127.0.0.1:10518', {unknown_option: true});
----
Unsupported datadog_serve option 'unknown_option'

statement error
SELECT datadog_serve('datadog:127.0.0.1:10518', {schema_name: 'main', schema: 'main'});
----
are aliases; use only one

statement error
SELECT datadog_serve('datadog:127.0.0.1:10518', '');
----
API key must not be empty

# Calling it without any datadog secret gives a helpful error (this only binds; no network call).
statement error
SELECT * FROM read_datadog_logs(query => '*', "from" => 'now-15m', "to" => 'now');
----
No 'datadog' secret found

# The service map requires an explicit environment before credentials are resolved.
statement error
DESCRIBE SELECT * FROM read_datadog_service_dependencies();
----
environment must not be empty

# send_datadog_logs resolves credentials at bind time, so without a secret binding already fails
# (DESCRIBE binds without executing, so no log is actually sent).
statement error
DESCRIBE SELECT send_datadog_logs({'body': 'hi', 'service_name': 's'});
----
No 'datadog' secret found

# A non-struct argument is rejected at bind time with a helpful message.
statement error
DESCRIBE SELECT send_datadog_logs('not a struct');
----
must be a STRUCT

# Catalog attachment validates credentials before doing anything else. Explicit INDEXES keeps
# this path offline while preserving the same helpful missing-secret error.
statement error
ATTACH 'datadog:' AS dd_missing (TYPE datadog, INDEXES ['main']);
----
No 'datadog' secret found

# The custom secret type works.
statement ok
CREATE SECRET dd_test (
    TYPE datadog,
    API_KEY 'SECRET_API_KEY_VALUE',
    APP_KEY 'SECRET_APP_KEY_VALUE',
    SITE 'datadoghq.eu'
);

query I
SELECT type FROM duckdb_secrets() WHERE name = 'dd_test';
----
datadog

# API/APP keys are redacted, never shown in duckdb_secrets().
query I
SELECT secret_string NOT LIKE '%SECRET_API_KEY_VALUE%' AND secret_string NOT LIKE '%SECRET_APP_KEY_VALUE%'
FROM duckdb_secrets() WHERE name = 'dd_test';
----
true

# With a secret present, binding succeeds and exposes the OTLP-conformant schema (bind only, no
# network call is made until the scan runs).
query I
SELECT count(*) FROM (DESCRIBE SELECT * FROM read_datadog_logs(query => '*', "from" => 'now-15m', "to" => 'now'));
----
18

# Key OTLP columns are present (order-independent).
query I
SELECT count(*) FROM (DESCRIBE SELECT * FROM read_datadog_logs(query => '*', "from" => 'now-15m', "to" => 'now'))
WHERE column_name IN ('time_unix_nano', 'observed_time_unix_nano', 'trace_id', 'span_id', 'severity_number',
                      'severity_text', 'body', 'resource_attributes', 'log_attributes', 'flags');
----
10

# Service dependencies expose the canonical directed-edge schema (bind only; no API call).
query I
SELECT count(*) FROM (DESCRIBE SELECT * FROM read_datadog_service_dependencies(env => 'prod'));
----
17

query II
SELECT column_name, column_type
FROM (DESCRIBE SELECT * FROM read_datadog_service_dependencies(env => 'prod'));
----
provider	VARCHAR
source_service	VARCHAR
target_service	VARCHAR
source_type	VARCHAR
target_type	VARCHAR
edge_type	VARCHAR
environment	VARCHAR
window_start	TIMESTAMP_NS
window_end	TIMESTAMP_NS
request_count	BIGINT
error_count	BIGINT
fault_count	BIGINT
throttle_count	BIGINT
total_response_time_seconds	DOUBLE
source_attributes	VARCHAR
target_attributes	VARCHAR
edge_attributes	VARCHAR

statement error
DESCRIBE SELECT * FROM read_datadog_service_dependencies(env => '');
----
environment must not be empty

statement error
DESCRIBE SELECT * FROM read_datadog_service_dependencies(env => 'prod', retries => -1);
----
retries must be >= 0

statement error
DESCRIBE SELECT * FROM read_datadog_service_dependencies(env => 'prod', timeout => 0);
----
timeout must be >= 1

query II
EXPLAIN (FORMAT JSON) SELECT * FROM read_datadog_service_dependencies(
    env => 'prod', "from" => '-15m', "to" => 'now', primary_tag => 'region:us-west-2',
    retries => 0, timeout => 15
);
----
physical_plan	<REGEX>:.*"Datadog Environment": "prod".*"Datadog From": "-15m".*"Datadog To": "now".*"Datadog Primary Tag": "region:us-west-2".*"Datadog Retries": "0".*"Datadog Timeout": "15".*

# With a secret present, send_datadog_logs binds to a VARCHAR result for any struct shape. Extra
# columns are ignored and missing OTLP columns are tolerated (bind only; no log is sent).
query I
SELECT count(*) FROM (DESCRIBE SELECT send_datadog_logs({'body': 'hi', 'service_name': 's', 'unknown_extra': 1}));
----
1

query I
SELECT column_type FROM (DESCRIBE SELECT send_datadog_logs({'body': 'hi'}));
----
VARCHAR

# The two-argument form (explicit secret name) also binds; an unknown secret name is a bind error.
statement error
DESCRIBE SELECT send_datadog_logs({'body': 'hi'}, 'no_such_secret');
----
No secret with name 'no_such_secret' found

# Named parameters are validated at bind time (no network call is needed to hit these errors).
statement error
SELECT * FROM read_datadog_logs(page_size => 0);
----
page_size must be between 1 and 1000

statement error
SELECT * FROM read_datadog_logs(page_size => 1001);
----
page_size must be between 1 and 1000

statement error
SELECT * FROM read_datadog_logs(max_rows => -1);
----
max_rows must be >= 0

statement error
SELECT * FROM read_datadog_logs(retries => -1);
----
retries must be >= 0

statement error
SELECT * FROM read_datadog_logs(timeout => 0);
----
timeout must be >= 1

query II
EXPLAIN (FORMAT JSON) SELECT * FROM read_datadog_logs(sort => '-timestamp');
----
physical_plan	<REGEX>:.*"Datadog Sort": "-timestamp".*

# Existing table-function defaults remain unchanged, including ascending sort and unlimited rows.
query II
EXPLAIN (FORMAT JSON) SELECT * FROM read_datadog_logs();
----
physical_plan	<REGEX>:.*"Datadog Sort": "timestamp".*"Datadog Page Size": "1000".*"Datadog Max Rows": "0".*"Datadog Retries": "4".*"Datadog Timeout": "60".*

statement error
SELECT * FROM read_datadog_logs(sort => 'newest');
----
sort must be either 'timestamp' or '-timestamp'

# The old page-size parameter name is gone (renamed to page_size before any release).
statement error
SELECT * FROM read_datadog_logs("limit" => 10);
----
Invalid named parameter

# Explicit indexes bypass network discovery entirely. Duplicate names are removed in input order.
statement ok
ATTACH 'datadog:' AS dd (
    TYPE datadog,
    SECRET 'dd_test',
    INDEXES ['main', 'security-events', 'main']
);

query I
SELECT count(*) FROM duckdb_schemas() WHERE database_name = 'dd' AND schema_name = 'logs';
----
1

# Open alerts are exposed as triggered monitor groups, matching Datadog's Triggered Monitors page.
query I
SELECT count(*) FROM duckdb_schemas() WHERE database_name = 'dd' AND schema_name = 'alerts';
----
1

# The service-map catalog surface exists even when this backward-compatible attachment omitted
# SERVICE_MAP_ENV.
query I
SELECT count(*) FROM duckdb_schemas() WHERE database_name = 'dd' AND schema_name = 'service_map';
----
1

query I
SELECT count(*) FROM duckdb_tables()
WHERE database_name = 'dd' AND schema_name = 'service_map' AND table_name = 'dependencies';
----
1

query I
SELECT count(*) FROM (DESCRIBE SELECT * FROM dd.service_map.dependencies);
----
17

# The focused configuration error occurs only when the lazy table is executed.
statement error
SELECT * FROM dd.service_map.dependencies;
----
SERVICE_MAP_ENV

query I
SELECT count(*) FROM duckdb_tables()
WHERE database_name = 'dd' AND schema_name = 'alerts' AND table_name = 'open';
----
1

query I
SELECT count(*) FROM (DESCRIBE SELECT * FROM dd.alerts.open);
----
7

query I rowsort
SELECT column_name || ':' || column_type
FROM (DESCRIBE SELECT * FROM dd.alerts.open);
----
group_name:VARCHAR
group_tags:VARCHAR[]
last_nodata_at:TIMESTAMP
last_triggered_at:TIMESTAMP
monitor_id:BIGINT
monitor_name:VARCHAR
status:VARCHAR

# Binding and planning the table is network-free; the monitor API is called only when scanned.
query II
EXPLAIN (FORMAT JSON) SELECT monitor_id, status FROM dd.alerts.open;
----
physical_plan	<REGEX>:.*"Datadog Alert States": "Alert, Warn, No Data".*"Datadog Page Size": "100".*

query I
SELECT count(*) FROM duckdb_tables() WHERE database_name = 'dd' AND schema_name = 'logs';
----
2

query I
SELECT count(*) FROM duckdb_tables()
WHERE database_name = 'dd' AND schema_name = 'logs' AND table_name = 'main';
----
1

query I rowsort
SELECT table_name FROM duckdb_tables() WHERE database_name = 'dd' AND schema_name = 'logs';
----
main
security-events

# Catalog tables and the stable table function expose exactly the same 18 columns and types.
query I
SELECT count(*) FROM (DESCRIBE SELECT * FROM dd.logs.main);
----
18

# Supported WHERE predicates bind through the catalog without executing a network request.
# They are translated conservatively and remain as DuckDB residual filters.
statement ok
EXPLAIN SELECT body FROM dd.logs.main
WHERE service_name = 'edge'
  AND severity_text = 'error'
  AND time_unix_nano >= TIMESTAMP_NS '2026-01-01 00:00:00';

# max_rows caps the table function before SQL WHERE evaluation, so remote pushdown must be
# disabled or it would change which rows participate in the cap.
query II
EXPLAIN (FORMAT JSON)
SELECT body FROM read_datadog_logs(max_rows => 1) WHERE service_name = 'edge';
----
physical_plan	<REGEX>:.*"Datadog Query": "[*]".*

# Unsupported shapes remain ordinary local DuckDB filters.
statement ok
EXPLAIN SELECT body FROM dd.logs.main
WHERE body LIKE '%timeout%' OR severity_number >= 17;

query I
SELECT count(*)
FROM (
    (SELECT column_name, column_type FROM (DESCRIBE SELECT * FROM dd.logs.main))
    EXCEPT ALL
    (SELECT column_name, column_type FROM (DESCRIBE SELECT * FROM read_datadog_logs()))
);
----
0

# Datadog index names are preserved and names requiring quoting bind normally.
query I
SELECT count(*) FROM (DESCRIBE SELECT * FROM dd.logs."security-events");
----
18

# Bounded catalog settings are retained in table metadata and copied into scan bind data.
statement ok
ATTACH 'datadog:' AS dd_bounded (
    TYPE datadog,
    SECRET 'dd_test',
    INDEXES ['main'],
    SORT '-timestamp',
    PAGE_SIZE 100,
    MAX_ROWS 100,
    RETRIES 0,
    TIMEOUT 15,
    SERVICE_MAP_ENV 'prod',
    SERVICE_MAP_START_TIME '-15m',
    SERVICE_MAP_END_TIME 'now',
    SERVICE_MAP_PRIMARY_TAG 'region:us-west-2'
);

query II
EXPLAIN (FORMAT JSON) SELECT * FROM dd_bounded.logs.main;
----
physical_plan	<REGEX>:.*"Datadog Sort": "-timestamp".*"Datadog Page Size": "100".*"Datadog Max Rows": "100".*"Datadog Retries": "0".*"Datadog Timeout": "15".*

query II
EXPLAIN (FORMAT JSON) SELECT * FROM dd_bounded.alerts.open;
----
physical_plan	<REGEX>:.*"Datadog Alert States": "Alert, Warn, No Data".*"Datadog Retries": "0".*"Datadog Timeout": "15".*

# Catalog and function use the same scanner schema; planning remains network-free and retains
# relative windows verbatim until scan initialization.
query II
EXPLAIN (FORMAT JSON) SELECT * FROM dd_bounded.service_map.dependencies;
----
physical_plan	<REGEX>:.*"Datadog Environment": "prod".*"Datadog From": "-15m".*"Datadog To": "now".*"Datadog Primary Tag": "region:us-west-2".*"Datadog Retries": "0".*"Datadog Timeout": "15".*

query I
SELECT count(*)
FROM (
    (SELECT column_name, column_type FROM (DESCRIBE SELECT * FROM dd_bounded.service_map.dependencies))
    EXCEPT ALL
    (SELECT column_name, column_type FROM (
        DESCRIBE SELECT * FROM read_datadog_service_dependencies(env => 'prod')
    ))
);
----
0

# MAX_ROWS caps the source relation before SQL WHERE evaluation, including for catalog scans.
# The remote query must therefore remain '*' and DuckDB retains the residual filter.
query II
EXPLAIN (FORMAT JSON) SELECT body FROM dd_bounded.logs.main WHERE service_name = 'edge';
----
physical_plan	<REGEX>:.*"Datadog Query": "[*]".*

statement ok
DETACH dd_bounded;

# All bounded ATTACH options reject invalid values before a catalog is created.
statement error
ATTACH 'datadog:' AS dd_bad_sort (TYPE datadog, SECRET 'dd_test', INDEXES ['main'], SORT 'newest');
----
sort must be either 'timestamp' or '-timestamp'

statement error
ATTACH 'datadog:' AS dd_bad_page_zero (TYPE datadog, SECRET 'dd_test', INDEXES ['main'], PAGE_SIZE 0);
----
page_size must be between 1 and 1000

statement error
ATTACH 'datadog:' AS dd_bad_page_large (TYPE datadog, SECRET 'dd_test', INDEXES ['main'], PAGE_SIZE 1001);
----
page_size must be between 1 and 1000

statement error
ATTACH 'datadog:' AS dd_bad_max_rows (TYPE datadog, SECRET 'dd_test', INDEXES ['main'], MAX_ROWS -1);
----
max_rows must be >= 0

statement error
ATTACH 'datadog:' AS dd_bad_retries (TYPE datadog, SECRET 'dd_test', INDEXES ['main'], RETRIES -1);
----
retries must be >= 0

statement error
ATTACH 'datadog:' AS dd_bad_timeout (TYPE datadog, SECRET 'dd_test', INDEXES ['main'], TIMEOUT 0);
----
timeout must be >= 1

# Explicit names must be non-null and non-empty.
statement error
ATTACH 'datadog:' AS dd_null (TYPE datadog, SECRET 'dd_test', INDEXES ['main', NULL]);
----
INDEXES must contain only non-null VARCHAR names

statement error
ATTACH 'datadog:' AS dd_empty (TYPE datadog, SECRET 'dd_test', INDEXES ['']);
----
INDEXES must not contain empty index names

# Unknown storage options fail at attach time with a useful allow-list.
statement error
ATTACH 'datadog:' AS dd_bad_option (TYPE datadog, SECRET 'dd_test', INDEXES ['main'], FOO 'bar');
----
Unsupported Datadog ATTACH option 'foo'

# The attached catalog is genuinely read-only across DDL and DML paths.
statement error
CREATE TABLE dd.logs.nope(i INTEGER);
----
read-only

statement error
DROP TABLE dd.alerts.open;
----
read-only

statement error
DROP TABLE dd.service_map.dependencies;
----
read-only

statement error
DROP TABLE dd.logs.main;
----
read-only

statement error
ALTER TABLE dd.logs.main RENAME TO renamed;
----
read-only

statement error
INSERT INTO dd.logs.main (body) VALUES ('not allowed');
----
read-only

statement error
UPDATE dd.logs.main SET body = 'not allowed';
----
read-only

statement error
DELETE FROM dd.logs.main;
----
read-only

statement ok
DETACH dd;

query I
SELECT count(*) FROM duckdb_tables() WHERE database_name = 'dd';
----
0

# Omitting SECRET uses the same first in-scope Datadog secret selection as the table function.
statement ok
ATTACH 'datadog:' AS dd_default (TYPE datadog, INDEXES ['main']);

query I
SELECT count(*) FROM duckdb_tables() WHERE database_name = 'dd_default' AND table_name = 'main';
----
1

# The implicit selection is pinned at ATTACH. Replacing the available secrets must not silently
# redirect this catalog to another Datadog account.
statement ok
CREATE SECRET dd_other (
    TYPE datadog,
    API_KEY 'OTHER_API_KEY_VALUE',
    APP_KEY 'OTHER_APP_KEY_VALUE'
);

statement ok
DROP SECRET dd_test;

statement error
DESCRIBE SELECT * FROM dd_default.logs.main;
----
No secret with name 'dd_test' found

statement ok
DETACH dd_default;

statement ok
DROP SECRET dd_other;

# --- read_datadog_log_stats (offline) ----------------------------------------

query I
SELECT count(*) >= 1 FROM duckdb_functions() WHERE function_name = 'read_datadog_log_stats';
----
true

# Parameters are validated before credentials are resolved.
statement error
SELECT * FROM read_datadog_log_stats(query => '*', compute => 'cardinality');
----
requires metric

statement error
SELECT * FROM read_datadog_log_stats(query => '*', group_limit => 0);
----
group_limit must be between 1 and 10000

statement error
SELECT * FROM read_datadog_log_stats(query => '*', group_by => ['']);
----
must be non-empty

statement error
SELECT * FROM read_datadog_log_stats(query => '*', timeout => 0);
----
timeout must be >= 1

# All secrets were dropped above, so binding fails with guidance (no network call).
statement error
SELECT * FROM read_datadog_log_stats(query => '*');
----
No 'datadog' secret found

# The secret accepts an intake-URL override; it is configuration, not a credential.
statement ok
CREATE SECRET dd_intake (
    TYPE datadog,
    API_KEY 'API_KEY_VALUE',
    APP_KEY 'APP_KEY_VALUE',
    INTAKE_URL 'http://127.0.0.1:55520'
);

query I
SELECT count(*) FROM duckdb_secrets() WHERE name = 'dd_intake' AND secret_string LIKE '%127.0.0.1:55520%';
----
1

statement ok
DROP SECRET dd_intake;

# --- read_datadog_traces / write_datadog_traces (offline) ---------------------

query II
SELECT count(*) FILTER (WHERE function_name = 'read_datadog_traces') >= 1,
       count(*) FILTER (WHERE function_name = 'write_datadog_traces') >= 1
FROM duckdb_functions();
----
true	true

# Named parameters are validated before credentials are resolved.
statement error
SELECT * FROM read_datadog_traces(page_size => 0);
----
page_size must be between 1 and 1000

statement error
SELECT * FROM read_datadog_traces(max_rows => -1);
----
max_rows must be >= 0

statement error
SELECT * FROM read_datadog_traces(sort => 'newest');
----
sort must be either 'timestamp' or '-timestamp'

statement error
SELECT * FROM read_datadog_traces(timeout => 0);
----
timeout must be >= 1

# All secrets were dropped above, so binding the reader fails with guidance (no network call).
statement error
SELECT * FROM read_datadog_traces();
----
No 'datadog' secret found

# The trace writer targets a (local) Datadog Agent, which needs no credentials: it binds without
# any datadog secret in scope (bind only; nothing is sent).
query I
SELECT column_type FROM (DESCRIBE SELECT write_datadog_traces({'trace_id': 'ab12', 'span_id': 'cd34'}));
----
VARCHAR

# ...but the input struct must at least identify a span.
statement error
DESCRIBE SELECT write_datadog_traces({'name': 'orphan'});
----
must contain trace_id and span_id

statement error
DESCRIBE SELECT write_datadog_traces('not a struct');
----
must be a STRUCT

# An explicitly named secret must still exist.
statement error
DESCRIBE SELECT write_datadog_traces({'trace_id': 'ab', 'span_id': 'cd'}, 'no_such_secret');
----
No secret with name 'no_such_secret' found

# The secret accepts a trace-agent override; like intake_url it is configuration, not a credential.
statement ok
CREATE SECRET dd_traces (
    TYPE datadog,
    API_KEY 'API_KEY_VALUE',
    APP_KEY 'APP_KEY_VALUE',
    TRACE_AGENT_URL 'http://127.0.0.1:8136'
);

query I
SELECT count(*) FROM duckdb_secrets() WHERE name = 'dd_traces' AND secret_string LIKE '%127.0.0.1:8136%';
----
1

# With a secret present, the reader binds and exposes the 24-column duckdb-otlp traces schema
# (bind only; the spans API is called only when the scan runs).
query I
SELECT count(*) FROM (DESCRIBE SELECT * FROM read_datadog_traces(query => '*', "from" => 'now-15m', "to" => 'now'));
----
24

query I
SELECT count(*) FROM (DESCRIBE SELECT * FROM read_datadog_traces())
WHERE column_name IN ('start_time_unix_nano', 'duration_time_unix_nano', 'trace_id', 'span_id', 'parent_span_id',
                      'service_name', 'name', 'kind', 'status_code', 'status_status_message',
                      'resource_attributes', 'span_attributes', 'events_json', 'links_json', 'flags');
----
15

query II
SELECT column_name, column_type FROM (DESCRIBE SELECT * FROM read_datadog_traces())
WHERE column_name IN ('start_time_unix_nano', 'duration_time_unix_nano', 'kind') ORDER BY column_name;
----
duration_time_unix_nano	BIGINT
kind	INTEGER
start_time_unix_nano	TIMESTAMP_NS

# Planning is network-free and surfaces the request parameters.
query II
EXPLAIN (FORMAT JSON) SELECT * FROM read_datadog_traces(sort => '-timestamp', max_rows => 50);
----
physical_plan	<REGEX>:.*"Datadog Sort": "-timestamp".*"Datadog Max Rows": "50".*

query II
EXPLAIN (FORMAT JSON) SELECT * FROM read_datadog_traces();
----
physical_plan	<REGEX>:.*"Datadog Query": "[*]".*"Datadog From": "now-15m".*"Datadog To": "now".*"Datadog Sort": "timestamp".*"Datadog Page Size": "1000".*"Datadog Max Rows": "0".*"Datadog Retries": "4".*"Datadog Timeout": "60".*

statement ok
DROP SECRET dd_traces;

# TRACE_INTAKE 'direct' sends protobuf straight to the backend trace intake (no Agent). It needs
# an API key; a secret without one fails at bind, before anything is sent.
statement ok
CREATE SECRET dd_direct_nokey (TYPE datadog, TRACE_INTAKE 'direct');

statement error
DESCRIBE SELECT write_datadog_traces({'trace_id': 'ab', 'span_id': 'cd'}, 'dd_direct_nokey');
----
requires API_KEY

statement ok
DROP SECRET dd_direct_nokey;

# An unknown mode is rejected at bind.
statement ok
CREATE SECRET dd_direct_bad (TYPE datadog, API_KEY 'k', APP_KEY 'a', TRACE_INTAKE 'proxy');

statement error
DESCRIBE SELECT write_datadog_traces({'trace_id': 'ab', 'span_id': 'cd'}, 'dd_direct_bad');
----
must be 'agent' or 'direct'

statement ok
DROP SECRET dd_direct_bad;

# The two trace destinations are mutually exclusive.
statement ok
CREATE SECRET dd_direct_conflict (
    TYPE datadog, API_KEY 'k', APP_KEY 'a',
    TRACE_INTAKE 'direct', TRACE_AGENT_URL 'http://127.0.0.1:8126'
);

statement error
DESCRIBE SELECT write_datadog_traces({'trace_id': 'ab', 'span_id': 'cd'}, 'dd_direct_conflict');
----
mutually exclusive

statement ok
DROP SECRET dd_direct_conflict;

# A well-formed direct-intake secret binds offline (bind only; nothing is sent).
statement ok
CREATE SECRET dd_direct (TYPE datadog, API_KEY 'k', APP_KEY 'a', TRACE_INTAKE 'direct');

query I
SELECT column_type FROM (DESCRIBE SELECT write_datadog_traces({'trace_id': 'ab12', 'span_id': 'cd34'}, 'dd_direct'));
----
VARCHAR

statement ok
DROP SECRET dd_direct;
